{
  "hypothesis_id": "HYP-EXAMPLE-001",
  "title": "System-One adds value as a meta-policy over quantitative predictors",
  "economic_mechanism": "A bounded learned policy may combine heterogeneous predictors and abstain more effectively than fixed rules while remaining cheaper/faster than generative reasoning.",
  "market": null,
  "horizon": null,
  "primary_outcome": "incremental net execution-aware utility versus same-information LightGBM baseline",
  "baseline_set": [
    "no-trade/passive",
    "logistic stacking",
    "LightGBM meta-policy",
    "hand-authored rule policy"
  ],
  "null_set": [
    "randomized policy conditional on same opportunity set",
    "predictor-label permutation preserving regime blocks"
  ],
  "kill_criteria": [
    "No sealed out-of-sample net-utility improvement over LightGBM",
    "p99 decision age consumes usable signal half-life",
    "Calibration/semantic instability makes safe abstention infeasible"
  ],
  "status": "REGISTERED"
}
